След седмица заминаваме за Свети Спас, обаче сега реших да разгледам и по по-старите теми за него и има отзив от 2012г., че около басейните е мръсно, а до детския басейн имало и ръждив радиатор. Това наистина ли е така? Ето част от мнението, дали е все още така:   - детският кът има 5 играчки, образно казано, и повечето са счупени - обядвахме въднъж в ресторанта и лично на мен храната не ми хареса - доманитет в салатата ми бяха зелени и с дръжките, кюфтетата сурови - няма външен басейн, единият от басейните се намира под нещо като прозрачен навес, според мен хигиената около басейните не беше на ниво - имаше ръждясали радиатори, мръсотия по пода и т.н. - няма достатъчно шезлонги навън. Докато бяхме там имаше не повече от 10, които бяха заети. Абсолютно несъотвествие с капацитета на хотела - климатикът в стаята ни не работеше. След като помолихме на рецепцията да го погледнат, дойде един човек и каза, че това е капацитетът му. Така и не успяхме да охладим стаята до края на престоя ни - самата стая не беше нищо особено. Беше по-скоро тясна и мокетът беше много захабен. На балкона нямаше сушилник - интернет успявахме да хващаме или в лобито, или на балкона. В стаята определено нямаше. - не е сериозно в 5 звезден хотел да си искаш тоалетна хартия от рецепцията...  Ако всичко е вярно, по-добре изобщо да не ходя.,negative,ClassTypeNegative,ClassificationModelBG,-1051.2588946410742
Преди месец бяхме в Св. Спас. Единствено лошо впечатление ми направи това, че не се подсушаваше около басейните. За възрастни е трудно да се ходи, пък какво остава за малки деца. Иначе и храната, и чистотата в стаята бяха ок. Детският кът сега е преместен срещу ресторанта- има няколко занимателни играчки за по- малки деца, по- големите рисуват. ,positive,ClassTypePositive,ClassificationModelBG,-316.5866726145252
Еее, че то от 2012 може пет пъти да са сменили чистачите.  Не е лош хотела, водата е топла, храната е хубава, ако не е препълнено и сте с добра компания ще си изкарате страхотно!,positive,ClassTypePositive,ClassificationModelBG,-192.00094504127858
Здравейте, дали има някой със скорошни впечатления от комплекс Беркут, понеже тук има една тема от 2011, а и в нета не намирам никакви скорошни мнения за същият.   Задавам въпроса, понеже мислим да го посетим в близките две седмици и искам да знам дали си заслужава.   Предварително Ви Благодаря. ,positive,ClassTypePositive,ClassificationModelBG,-268.29889084885144
 Bled  , благодаря за темата!      Аз не мога да се похваля с ниски цени на хотели, та ще чета повече.    ,positive,ClassTypePositive,ClassificationModelBG,-109.93557919721954
А в момента разкопана ли е главната улица и има ли проблеми с водата. - режим, спирания.Повече ме интересува Чепино и Каменица. Ако някой може да каже ще съм благодарна,positive,ClassTypePositive,ClassificationModelBG,-157.5044217729014
Много интересни предложения! Вече си набелязах поне две хотелчета за пролетната ваканция на малките...че ние отдалеч планираме :) Видях в темата, че се препоръчва к-с Острова - общо взето става, ние бяхме очаровани от храната, но СПА центъра е плачевен, а водата твърда хладка за малки деца. Отвън детската площадка е близо до басейна, който през хладните месеци е празен и е доста опасно за децата. С една дума - цената и звездите, не отговарят на предлагането.  Още един глас за Дивата ферма в Горно поле - наистина уникално място, особено ако искате да сте близо до природата и децата да са близо до животинки.  Това лято бяхме в Исмена, Девин и за летен СПА хотел е идеален - особено за семейства с деца. Зеленина, стилен интериор и екстериор, с български мотиви, чуден детски център. Добър ресторант, особено ако сте по-търпеливи. Не става обаче за зимата - СПАто няма топла връзка.  Калиста Старозагорски бани е с хубав СПА център, наистина топла минерална вода, добро обслужване, чистичко, разкошен двор, в горичка, но пък не впечатлява с дизайн - личи се че е преустроена соц -станция.  Хотел АУРА във Велинград също ни е сред любимите - едни от най-разкошните басейни, въпреки че хотелчето е сравнително малко. Мисля, че имат и лекар, който препоръчва процедури. И за лято и за зима става, само дето му е малко дворчето, но пък парка е наблизо. Още не сме си открили идеалния хотел....,positive,ClassTypePositive,ClassificationModelBG,-1181.7449024356038
Главната улица е готова и асфалтирана, в Каменица и Чепино е кошмар! Режим на водата мисля само в Каменца.,negative,ClassTypePositive,ClassificationModelBG,-98.03872063797907
  Главната улица е готова и асфалтирана, в Каменица и Чепино е кошмар! Режим на водата мисля само в Каменца.   В смисъл? За хотел Велина дали се отнася режима, че мисля за там да резервирам, а той е май в Каменица ,negative,ClassTypePositive,ClassificationModelBG,-203.46490399431377
Велина е в Чепино, най- добре се обадете в хотела, мисля че този квартал си имат вода, но все пак питайте.,positive,ClassTypePositive,ClassificationModelBG,-121.04985209230016
Ако някой скоро е бил във Велина, нека пише дали има проблем. Инфото от хотела няма да бъде много достоверно струва ми се. Не очаквам да си признаят преди да платя. Има ли значение , че там и в баните има минерална вода, тоест явно не е от водопровода захранен хотела, или си въобразявам?,negative,ClassTypeNegative,ClassificationModelBG,-272.3813972502589
Много приятна тема, благодаря!  Ще следя с интерес.,positive,ClassTypePositive,ClassificationModelBG,-50.28813788602724
Мацки, защо в сайта  hotels.com  пише, че работи в следните държави ... следва дълъг списък, но България я няма? Само за езика на сайта ли се касае? Запазих си стая, но ми е чудно всичко ОК ли ще е с резервацията. Прощавайте за лаишкия въпрос, но аз досега само с Букинг съм имала взимане-даване.   ,negative,ClassTypeNegative,ClassificationModelBG,-257.15648239207536
  Мацки, защо в сайта  hotels.com  пише, че работи в следните държави ... следва дълъг списък, но България я няма? Само за езика на сайта ли се касае? Запазих си стая, но ми е чудно всичко ОК ли ще е с резервацията. Прощавайте за лаишкия въпрос, но аз досега само с Букинг съм имала взимане-даване.        Розова маслинка  Не се притеснявай, да това е езика на сайта, който искаш. Ако натиснеш до него, ще видиш, че дори има валута лев. Имам десетки резервации със сайта, достигнала съм ниво Gold Rewards и нямам никакви проблеми. Напротив през този сайт взимам и ползвам едни от най-големите отстъпки и бонуси. Само при определени промоции не се включва България, но това е друго. Резервирай спокойно...,positive,ClassTypeNegative,ClassificationModelBG,-550.1587606553694
    Мацки, защо в сайта  hotels.com  пише, че работи в следните държави ... следва дълъг списък, но България я няма? Само за езика на сайта ли се касае? Запазих си стая, но ми е чудно всичко ОК ли ще е с резервацията. Прощавайте за лаишкия въпрос, но аз досега само с Букинг съм имала взимане-даване.        Розова маслинка  Не се притеснявай, да това е езика на сайта, който искаш. Ако натиснеш до него, ще видиш, че дори има валута лев. Имам десетки резервации със сайта, достигнала съм ниво Gold Rewards и нямам никакви проблеми. Напротив през този сайт взимам и ползвам едни от най-големите отстъпки и бонуси. Само при определени промоции не се включва България, но това е друго. Резервирай спокойно...    Благодаря за отговора!    Аз точно заради една по-голяма отстъпка се полакомих... Хубав ден.   ,positive,ClassTypeNegative,ClassificationModelBG,-630.3179377863589
Някакви препоръки за зимно време, с малки деца (2г и 5г), евентуално ски и да не режат главата от кръста ....,negative,ClassTypePositive,ClassificationModelBG,-117.7562013078897
Ама само аз ли си пиша тук?    Сега започнах пътепис за Бали. 3 части са готови. Но ще има още. В третата част съм описала екскурзията ми до остров Ява и уникалните храмове Борободур и Прамбанан. Дано ви е интересно.     http://diana-cacaotours.blogspot.bg/ ,positive,ClassTypeNegative,ClassificationModelBG,-228.30999515067344
Диана, ти си пиши  D Страхотни пътеписи    ,positive,ClassTypePositive,ClassificationModelBG,-52.01337045937043
Аз се записвам тематично с един пост за    Коледния пазар в Дюселдорф  .  Иначе публикувах два пътеписа за Охрид и манастира Св. Наум. Скоро ще напиша и няколко реда за Струга.   Имам и отделна категория за Амстердам, която започвам да пълня с полезна информация - какво да се опита тук, транспорт, музеи и т.н.,positive,ClassTypePositive,ClassificationModelBG,-247.2027578481737
 Beija-flor , не ти се отваря линка. А толкова исках да го прочета, бях на Weinachtsmarkt  в Дюселдорф, Кьолн и Есен и ми се искаше някой да го разкаже, защото аз не мога да описвам тъй добре....    ,positive,ClassTypeNegative,ClassificationModelBG,-173.88554254332317
hris.g, благодаря! Оправих линка. Дано ти хареса,positive,ClassTypePositive,ClassificationModelBG,-37.471337451307065
Някакви нови хотелчета да сте открили из България?,positive,ClassTypeNegative,ClassificationModelBG,-57.2876992117439
  Диана, ти си пиши  D Страхотни пътеписи       +1   Отнася се за всички!,positive,ClassTypePositive,ClassificationModelBG,-78.38401600898138
Благодаря за интереса.    Вече виждам и други пътеписи. Аз много харесвам да чета разкази от първо лице. В някои от пътеписите намирам следващата ми дестинация. Например, от пътеписа на Роже за Бали видях идеята за остров Ява и Борободур. Радвам се, че я реализирах, защото наистина си заслужаваше. А на Роже - благодаря за идеята.  ,positive,ClassTypePositive,ClassificationModelBG,-270.2177795864819
Скоро се надявам да имаме и ние нов пътепис за Коледни базари във Виена. Миналата година писах за Прага то май за тиямдва града пишем най-много че не най често ги посещаваме.,positive,ClassTypePositive,ClassificationModelBG,-193.71841018356338
Момичета здравейте. Преди два дни се върнахме от Девин. Горещо препоръчвам х-л Персенк. Страхотен е! Прекрасно обслужване, спа-зоната е супер, водата в басейна около 30-32 градуса, в детския басейн и джакузито още по-топла. Нямам абсолютно никакви забележки.  Преди да отидем в Девин отседнахме за една нощувка в Пловдив. Хотела е Бизнес-хотел. Също го препоръчвам. Уютен, модерен, добро обслужване.,positive,ClassTypePositive,ClassificationModelBG,-337.11857546855623
  Може ли някой да препоръча хубави бунгала на северното черноморие. Ако са с кухня или кухненски бокс, хубав плаж и двор за децата, ще е супер. Вече почивахме 10 дни в Гърция и сега ни се иска в началото на август да направим още една малко по-евтина почивка.  Ако въпроса ми не е в правилната тема, моля насочете ме, търсих но не открих. Благодаря!   Бунгала Нимфа, Камчия. Страхотни са. ,positive,ClassTypePositive,ClassificationModelBG,-409.207369081911
Аз търся хубав хотел в София, ако може да има и СПА, добре.,positive,ClassTypePositive,ClassificationModelBG,-67.92816037286723
 ябълка , можеш да провериш как ти се струват хотел Макси в София (има и спа), както и Холидей Ин (също има приятен спа център).  ,positive,ClassTypePositive,ClassificationModelBG,-134.35179890179745
на Царско село спа-то е хубаво,positive,ClassTypePositive,ClassificationModelBG,-44.90167358881199
Момичета,мнения за Апарт хотел Евридика хилс в Пампорово?  ,positive,ClassTypePositive,ClassificationModelBG,-42.85454139307864
Аз имам въпрос . Планираме със Съпругата ми пътешествие до Италия. Офертата на която сме се спрели се предлага от туристическа агенция   ЕКСКУРЗИЯ   можели някой да ми каже имали впечатления от тази агенция?,positive,ClassTypePositive,ClassificationModelBG,-199.09180681527698
  Аз имам въпрос . Планираме със Съпругата ми пътешествие до Италия. Офертата на която сме се спрели се предлага от туристическа агенция   ЕКСКУРЗИЯ   можели някой да ми каже имали впечатления от тази агенция?   Има теми за ТА, а има и теми за Италия - Рим, Венеция, Флоренция е т.н.  потърси инфо там или попитай.,positive,ClassTypePositive,ClassificationModelBG,-292.42251635022575
Напоследък темата се превърна в Бюро - справки. Виждам,че има публикация, отварям да прочета положително мнение за някой хотели да го отбележа в списъка си и хоп - Препоръчайте ми.....или мнение за....Има достатъчно сайтове за мнения.,negative,ClassTypePositive,ClassificationModelBG,-229.77827563473494
Да споделя впечатление от един хотел. Исках да сме на Боровец но много скъпо ми се видя. Та отседнахме на 6 км от Боровец в Самоков в Хотел Бистрица. Е много добро обслужване останахме много доволни.Тъкмо за зимата за ски ще се отбиваме често.,negative,ClassTypePositive,ClassificationModelBG,-235.28391514176116
   ябълка , можеш да провериш как ти се струват хотел Макси в София (има и спа), както и Холидей Ин (също има приятен спа център).     Благодаря , Петя.,positive,ClassTypePositive,ClassificationModelBG,-140.2270757509364
