commentText, realClass, predictedClass, classifier, probability

чудесен хотел, отлично обслужване, богата закуска
,positive,ClassTypePositive,ClassificationModelBG,-48.880448110889134

много лоша организация на паркиране.
,negative,ClassTypePositive,ClassificationModelBG,-38.801576565118914

Стаите са добре обзаведени и чисти.
Закуската е добра.
,positive,ClassTypePositive,ClassificationModelBG,-52.1091494953103

Няма нещо което да не ти хареса в този хотел. Откакто го открих другите хотели във Варна нямат шанс за мен
,positive,ClassTypeNegative,ClassificationModelBG,-138.32701927017564

Хотелът е невероятен--модерен дизайн с много вкус и класа. Всичко бе на ниво, включително и персонала. Разположението е отлично, едно бижу в центъра на Варна.
,positive,ClassTypePositive,ClassificationModelBG,-140.77800687996944

Не може да очакваш гости в хотела, които няма да си пестят парите щом са направили резервация в него и в същото време да няма място къде да спреш пред него и спокойно да си смъкнеш багажа. Персоналът поема колите не само гости, но и клиенти на ресторанта и кафето. Изключително некоректно в този смисъл. Посочваш интервал от време, в което ще пристигнеш, ти си коректен и пристигаш в упоменатото време и накрая няма къде да спреш!!!
,negative,ClassTypeNegative,ClassificationModelBG,-332.37305750101245

Не мисля,че някой ще остане доволен ако му върнат колата осуркана по вина на човека ,който паркира колите на гостите на хотела!Това е недопустимо!
,negative,ClassTypeNegative,ClassificationModelBG,-164.2587048862654

Невероятен хотел!Дизайнерско обзавеждане,перфектно обслужване!
,positive,ClassTypePositive,ClassificationModelBG,-41.74817398911604

Невероятен хотел.Прекрасно обслужване.Благодаря Ви!Щастлива съм ,че Ви избрах!
,positive,ClassTypePositive,ClassificationModelBG,-75.1413148318993

Трудно паркиране през деня; няма wi-fi в стаите, а само на рецепция; обявената в интернет цена беше значително по-висока спрямо обявената на рецепция; закуската е след 9
,negative,ClassTypeNegative,ClassificationModelBG,-138.37914772049126

Не съм очаквала, че на такова място може да съществува такъв вид място за сън. Неподдържано и мръсно.
,negative,ClassTypeNegative,ClassificationModelBG,-117.23207904317472

В най-скъпата стая делукс бяхме : без отопление в банята,малък и лош климатик който не можеше да отопли стаята,само по 1 тънко одеало на човек и ужасно твърди мънички възглавници .Вратата на балкона не се затваряше плътно и идваше студ и от вън!Бяхме единствените гости в хотела,явно поради лошите условия .Платената закуска въобще нямаше,казаха че почва от 8 и нищо не беше приготвено.Надявам се скоро да забравим тоя кошмар и лошо обслужване и студ в тоя ужасен хотел!
,negative,ClassTypeNegative,ClassificationModelBG,-462.0497977973078

Персоналът беше изключително отзивчив и любезен.
,positive,ClassTypePositive,ClassificationModelBG,-39.941410396729964

Лоша хигиена, мръсна и неприветлива рецепция. Неподготвена стая - раздават кърпи и чаршафи на рецепцията. Теч от ваната на пода в банята, липса на крушки за някои лампи, счупени закачалки за кърпи, мръсни прозорци, пропадащ матрак.
,negative,ClassTypeNegative,ClassificationModelBG,-213.43877966912063

Ужасен път до там. Достъпът откъм центъра не е препоръчителен за по-ниски коли. Никкакви указателни табели, но Google навигацията го открива безпроблемно.
,negative,ClassTypePositive,ClassificationModelBG,-155.4872081856114

Любезен персонал, който те кара да се чувстваш като у дома си. Прекрасна гледка, спокойствие..
,positive,ClassTypePositive,ClassificationModelBG,-107.48722429660353

Базата е стара и има нужда от обновяване, нямаше налягане на водата в банята. Достъпа до хотела е по доста стръмна  и тясна улица, но спокойно може да се стигне с лека кола. Пред хотела имаше строеж след 8,30 - 9,00 започваха работа и със спането беше до там, хубавото е, че сградите, които се строят няма да попречат на гледката
,negative,ClassTypeNegative,ClassificationModelBG,-324.1849903838332

Много хубава гледка. Отношението на собствениците и готовността им да помагат да се ориентираме, къде се намира хотела. Кафето беше много добро.
,positive,ClassTypePositive,ClassificationModelBG,-131.0997106782036

нямам никакви забележки!персоналът изключително любезен и усмихнат,в
стаите беше чисто и поддържано!с удоволствие ще отседнем отново!
,positive,ClassTypePositive,ClassificationModelBG,-120.21310109612142

Разположението! Почти невъзможно е да се открие. Няма такава улица и номер!  Много трудно го открихме. Интернетът почти липсва.
,negative,ClassTypeNegative,ClassificationModelBG,-118.35722091644128

Добро отношение от персонала, дори ни предоставиха съседния апартамент безплатно.
,positive,ClassTypeNegative,ClassificationModelBG,-69.26899254053885

Перфектна локация, просторна баня, комфортна стая. Закуската в ресторант ''Панорама" предоставя чудесна гледка към морето и града !
,positive,ClassTypePositive,ClassificationModelBG,-107.21041590471106

Би било добре да се почистват не само стаите, но и терасите, особено парапетите. Хубаво е да има стол на терасата.
,negative,ClassTypePositive,ClassificationModelBG,-130.60736397485243

Разположението е централно - в близост до забележителности, Морската градина, Делфинариума, Детския кът, Двореца на културата и спорта, плажа, крайбрежната алея. 
Стаята и ресторанта предлагаха чудесна гледка.
Стаята беше просторна и удобна.

,positive,ClassTypePositive,ClassificationModelBG,-203.1226225183044

Не работят телевизорите добре и ТВ сигнала е с много качество!
,negative,ClassTypeNegative,ClassificationModelBG,-55.15871885058282

Интернета е много слаб, почти за нищо не става. Водата спря, но това беше поради повреда в цяла Варна.
,negative,ClassTypeNegative,ClassificationModelBG,-119.24700812182228

Малко позамръзнахме докато се постопли стаята. С този стар и малък климатик голямата комфортна стая се стопли долу горе за 8 часа при условие че температурата навънка беше над 1-2 градуса вътре едвам стана около 18 градуса, иначе всичко друго беше супер.
,negative,ClassTypeNegative,ClassificationModelBG,-235.19957326453982

Чувстваме се отлично при престоя си в хотел "Черно море" гр.Варна. Три поредни години сме  тук за кратко и ако имаме възможност отново ще дойдем. Всичко най добро събрано на едно място.
,positive,ClassTypePositive,ClassificationModelBG,-226.74674529154862

Не почистиха стаята, камериерката Роза излъга, че е имало бележка не безпокойте, при положение, че ние изобщо не сме слагали такава.Очевидно това е номер да не почистват.Не работеше климатика.
,negative,ClassTypeNegative,ClassificationModelBG,-185.4290629763587

Комфорта на стаите и обзавеждането във никакъв случай не отговарят на категорията.
,negative,ClassTypeNegative,ClassificationModelBG,-81.0348113720663

Нелюбезното и непрофесионално отношение на определени лица
,negative,ClassTypeNegative,ClassificationModelBG,-33.31631521251514

Снимките не отговарят на действителноста. Евтина храна, приготвена зле. Новогодишната "вечеря" с платен отделно алкохол, който не е включен в куверта. В апартамента липсваше  маса и столове. За 300 лв на вечер спиш на разгъната табуретка в хола или се ръбиш на най- евтиния  възможен матрак в спалнята. Телевизията с 5 програми. Спа центърът е мръсен и мирише на автобусна спирка. Фитнесът с оценка 3.5. Бравата на входната врата заяждаше постоянно. Кухнята в апартамента е оборудвана само с 4 чаши. Това и за 2 звезди не стига, камоли за 4 звезди и 1800 лв за 6 нощувки. На всичкото отгоре ти взимат парите 5 мин. след като направиш резервация през booking. Явно за да не размисли човек. Казаха, че не могат да издадат фактура за престоя,  защото било платено миналата година т.е. преди  няколко дни.
,negative,ClassTypeNegative,ClassificationModelBG,-686.3008291953171

Прекрасен хотел с много удобства,вкусна храна и любезен персонал.
,positive,ClassTypePositive,ClassificationModelBG,-59.950197895628435

Всичко - вътрешен басейн с топла вода (температура 25-26гр., а на въздуха на термометър 29гр.), има и парна баня и сауна в цената на нощувката,  блок масата на ресторанта, особено за вечеря - е с много разнообразни ястия и десерти, стаите са големи и чисти - всичко в тях е ново.
Хотела се намира в близост до пътеките към горите над Банско, далече си от блъсканицата и пренаселеността в центъра на курорта.
Има много приятна рекичка до хотела, която леко ромоли и създава едно истинско усещане за почивка в планината.
,positive,ClassTypePositive,ClassificationModelBG,-453.1925390791198


Кухнята в апартамента не е оборудвана със съдове и прибори
,negative,ClassTypePositive,ClassificationModelBG,-50.366707133045246

Тихо,спокойно идеално за семейна почивка!
,positive,ClassTypePositive,ClassificationModelBG,-46.7804548842314

Температурата в басейна -казаха 27 градуса, но се оказа доста по-ниска, а в коридора 17 градуса. Стаите се отопляват с "духалки", няма шведска маса - храната е на сет меню. Ползването на парна баня и сауна е след едночасова предварителна заявка. Не става за почивка с малки деца.
Не отговаря на четиризвезден хотел.
,negative,ClassTypePositive,ClassificationModelBG,-278.2022216250656

Не ни хареса спа рецепцията и масажистката, правят неуместни забележки. И е пълна недомислица фитнеса и детския кът  да са в спа зоната за релакс. На детския кът имаше надпис -ПАЗЕТЕ ТИШИНА. Кое дете ще пази тишина докато играе??? И кой ще дига щанги без да тропа?  Преместете си Или спа зоната или фитнеса и детския кът. Още веднъж - много глупаво разположение!!!!!!!
,negative,ClassTypeNegative,ClassificationModelBG,-291.22540257341996

В деня в който се настанявахме с малката ни дъщеря ( 1,5 г ) в стая беше  16 градуса. На рецепция казаха че всички стаи се топлят с духалки и това е. 
Закуската е невероятно гадна, но не по- лоша от вечерята. В лоби бара е студено и почти никога няма персонал.
,negative,ClassTypeNegative,ClassificationModelBG,-255.94073627215707

МНОГО ХУБАВ АПАРТАМЕНТ, ТОПЪЛ И ПРОСТОРЕН
,positive,ClassTypePositive,ClassificationModelBG,-37.35559088146305

ХРАНАТА БЕШЕ ОТВРАТИТЕЛНА, ГОТВАЧА МАЙ ТРЯБВА ДА СЕ СМЕНИ.
,negative,ClassTypeNegative,ClassificationModelBG,-67.46202448730037

На първо място отношението. Дори на представилата ни се, като собственичка госпожа. За нея, както и за персонала на хотела, с изключение момичетата на рецепция, категории, като туризъм, клиент, гостоприемство и удовлетвореност са абсолютно непознати. 
Гостите на хотела са нищо друго, но "дойни крави".
Храната е ужасна, изборът беден. Това важи и за закуската, и за вечерята.
Даже и децата не искаха да се хранят в ресторанта на хотела.
Обзавеждането в стаите е овехтяло и разбито.
Душ батерията изисква хавлиена кърпа и доста сила, за да може да се пусне душа. 
Вратата на банята не се затваря.
Пердето на ваната виси като съдран чувал.
За топла вода чаках точно два часа, от 15:30 до 17:30. Но може би така се спестяват природни ресурси! За какво им е на гостите да се къпят!
Когато се настанихме, банята беше непочистена от предишните гости.
За илюстрация: приятелите ни от Истанбул, които  бяха предплатили 10 нощувки, на петия ден напуснаха хотела и потеглиха за Виена.
Ние, слава Богу, бяхме само за 2 дни.
Дори и без пари да имам възможност да отседна във Вихрен Палас и бла, бла, никога не бих повторила.
,negative,ClassTypeNegative,ClassificationModelBG,-894.7090606426237

Отвратително обслужване. Ужасна храна и кусел персонал. Няма да дойда отново.
,negative,ClassTypePositive,ClassificationModelBG,-73.64447570998317
  Видях ресторант Виктория. Много добре изглежда на снимките, но на нас ще ни е далече от Лъки. В сайта на хотела пише, че ще има безплатен транспорт от хотела до центъра и обратно. Какво е шатъл, като вид превоз      не съм им ползвала превоза, дори не знаех, че предлагат :) но както вече са ти писали - шатъл е обикновено микробус, който се движи по разписание,positive,ClassTypePositive,ClassificationModelBG,-328.0784701794282
  Към завърналите се от Велинград - тези дни в новините имаше репортаж, че имало  режим на водата  - вярно ли е? И че имало проблем с водоснабдяването и в хотелите :( Мислех да запазя за Коледа, но направо се разколебах....   Днес също даваха по новините, че има проблеми с водата, както и че улиците са разкопани, точно в центъра. Някой знае ли как е в момента положението, че тези цени, които са накачили не предполагат прескачане на кални ями и безводие. Даваха по ТВ, че раздават кофи с вода по стаите - голямо СПА ще е като няма вода.,negative,ClassTypeNegative,ClassificationModelBG,-440.04462760126006
Нямаше ли и миналата година проблем с водата? Или с тока май беше, когато имаше много сняг зимата. На мен много ми се ходи пак м/у празниците, но не знам какво ще е положението и отсега не ми се рискува с резервации.,negative,ClassTypeNegative,ClassificationModelBG,-222.46419779634383
  Нямаше ли и миналата година проблем с водата? Или с тока май беше, когато имаше много сняг зимата. На мен много ми се ходи пак м/у празниците, но не знам какво ще е положението и отсега не ми се рискува с резервации.   Имаше проблем с тока на 8-ми март, много сняг беше паднал и имаше бедствено положение. Тогава няколко хотела работеха с агрегар и пак е било възможно да се почива. Но без вода не си представям какво СПА ще е. И аз искам да резервирам между празниците, но сега се разколебах честно казано.,negative,ClassTypeNegative,ClassificationModelBG,-428.1485335569308
  Съвсем пресни впечатления от Аура, от последния уикенд. Последно съм го посещавала лятото на 2010. Стаите, баните и ресторантът са реновирани, което е чудесно, но за сметка на това басейните са леко занемарени. Водата е чиста и много топла, но тук там са откъртени плочки по дъното и стените. Белите мечки са леко  почернели  на места, дюзите на студената вода в атракционната пътека са запушени и не работят добре. Детският басейн  е изцяло открит, което за някои родители е неприятно (аз лично смятам, че е добре децата да се каляват в такива басейни). Външното джакузи е с гореща вода и работи целогодишно. Закачалките покрай закрития басейн са само две и са крайно недостатъчни. Целият хотел е много топъл, водата в баните е минерална. Препоръка - ходете в дните от неделя до четвъртък, много по-спокойно е.  Ако някой се интересува от нещо по-конкретно да пита.    Аз съм била в този хотел и ми хареса ,впечатленията ми са като твоите, аз го посетих през март тази година. Но като си тръгвахме установих, че май има още един вътрешен басейн, който не сме забелязали, май там, където е парната баня и сауната - на един етаж под рецепцията. Нали не съм се заблудила и там наистина има още един вътрешен басейн? ,positive,ClassTypePositive,ClassificationModelBG,-1002.2518133408698
Във всички големи хотели вода има и не е спирала изобщо, разкопките са към Каменица основно и там има режим на водата.,positive,ClassTypePositive,ClassificationModelBG,-112.07759314695338
  Към завърналите се от Велинград - тези дни в новините имаше репортаж, че имало  режим на водата      Такива неща няма да научите при резервацията или като прочетете  рекламните материали за СВЕТОВНАТА СПА СТОЛИЦА    Няма да прочетете и че селото е разорано вече не знам колко месеца.НО ще научите че цените са увеличени и ви таксуват допълнито за разни неща понеже видиш ли било празник и има разни заблудени балъци     но това е стара максима,докато има балъци ще има и тарикати,negative,ClassTypeNegative,ClassificationModelBG,-388.081539099179
   Аз съм била в този хотел и ми хареса ,впечатленията ми са като твоите, аз го посетих през март тази година. Но като си тръгвахме установих, че май има още един вътрешен басейн, който не сме забелязали, май там, където е парната баня и сауната - на един етаж под рецепцията. Нали не съм се заблудила и там наистина има още един вътрешен басейн?     Да, има малък вътрешен басейн, но на мен лично не ми харесва и не го ползвам, защото е много тъмно и няма въздух. Предпочитам горещата вода на открито. ,positive,ClassTypePositive,ClassificationModelBG,-441.05104113505564
